{
  "features": {
    "aiTagging": true
  },
  "brand": {
    "name": "贤者时间",
    "establishedYear": 2019,
    "meta": {
      "description": "《贤者时间》一档从普通人视角观察其他普通人的播客节目，由小张和治治主持。",
      "keywords": "贤者时间，播客，小宇宙，深夜谈话，哲思问答",
      "author": "贤者时间",
      "twitter": "@xianzheshijian",
      "ogDescription": "《贤者时间》一档从普通人视角观察其他普通人的播客节目"
    }
  },
  "assets": {
    "defaultCover": "https://image.xyzcdn.net/Ft2Qhwlu1ZjEP4EUC3ckZ1vmGiJ5.png",
    "ogImage": "https://xzsj.netlify.app/og.jpg",
    "favicon": "https://image.xyzcdn.net/Ft2Qhwlu1ZjEP4EUC3ckZ1vmGiJ5.png"
  },
  "podcast": {
    "rssUrl": "https://feed.xyzfm.space/vqdkjlfwbkrd",
    "appleUrl": "https://podcasts.apple.com/us/podcast/%E8%B4%A4%E8%80%85%E6%97%B6%E9%97%B4/id1635378899",
    "xiaoyuzhouUrl": "https://www.xiaoyuzhoufm.com/podcast/5e285523418a84a04627767d",
    "xiaoyuzhouQr": "https://static.xiaoyuzhoufm.com/qrcode/eyJ1cmwiOiJodHRwczovL3d3dy54aWFveXV6aG91Zm0uY29tL3BvZGNhc3QvNWUyODU1MjM0MThhODRhMDQ2Mjc3NjdkIiwic2l6ZSI6MTUwfQ%3D%3D",
    "wechatQr": "https://open.weixin.qq.com/qr/code?username=killtimepodcast"
  },
  "navigation": [
    {
      "label": "首页",
      "href": "/"
    },
    {
      "label": "全部节目",
      "href": "/episodes"
    },
    {
      "label": "探索主题",
      "href": "/themes"
    },
    {
      "label": "关于我们",
      "href": "/about"
    }
  ],
  "hero": {
    "titlePrefix": "比起宏大的叙事，我们更关心",
    "titleHighlight": "具体的个人",
    "titleSuffix": "。",
    "description": "在这里，我们剥开生活的复杂，记录那些真实、琐碎且充满生命力的瞬间。",
    "cta": {
      "listenLatestLabel": "收听最新一期",
      "browseAllDesktopLabel": "浏览全部剧集",
      "browseAllMobileLabel": "浏览全部",
      "learnMoreLabel": "了解我们"
    }
  },
  "sections": {
    "recentSubtitle": "Recent",
    "recentTitle": "最近更新",
    "recentBrowseAllLabel": "浏览全部",
    "themesTitle": "探索主题",
    "rssTitle": "保持连接",
    "rssDescription": "除了网页，你也可以在以下平台订阅我们。",
    "rssLabels": {
      "apple": "Apple Podcasts",
      "rss": "RSS 订阅",
      "xiaoyuzhou": "小宇宙",
      "wechat": "微信公众号"
    }
  },
  "ui": {
    "openMenuLabel": "打开菜单",
    "closeMenuLabel": "关闭菜单",
    "backToTopLabel": "回到顶部",
    "playLabel": "播放",
    "pauseLabel": "暂停",
    "playEpisodeAriaLabel": "播放剧集",
    "playLatestAriaLabel": "播放最新剧集",
    "downloadLabel": "下载",
    "shareLabel": "分享",
    "detailLabel": "详情",
    "closeLabel": "关闭",
    "unknownDurationLabel": "未知时长",
    "unknownSizeLabel": "未知大小",
    "episodeNumberPrefix": "Ep",
    "episodeNumberFallbackLabel": "Special"
  },
  "pages": {
    "home": {
      "title": "首页"
    },
    "episodes": {
      "title": "全部节目",
      "headline": "全部节目",
      "description": "这里记录了我们所有的对话。你可以按年份进行筛选，或者使用搜索功能查找感兴趣的话题。",
      "activeThemeLabel": "当前主题",
      "clearThemeTitle": "移除主题筛选",
      "searchLabel": "搜索节目",
      "searchPlaceholder": "搜索标题、内容...",
      "searchClearTitle": "清空搜索",
      "searchCountPrefix": "共找到",
      "searchCountSuffix": "个结果",
      "yearFilterTitle": "按年份筛选",
      "allYearsLabel": "全部",
      "tagFilterTitle": "按标签筛选",
      "clearTagLabel": "清除筛选",
      "toggleTagsExpandLabel": "展开更多",
      "toggleTagsCollapseLabel": "收起",
      "emptyTitle": "没有找到相关的节目",
      "emptySubtitle": "换个关键词，或者尝试不同的年份？"
    },
    "themes": {
      "title": "探索主题",
      "headline": "探索主题",
      "emptyLabel": "暂无相关节目"
    },
    "about": {
      "title": "关于我们"
    },
    "episodeDetail": {
      "breadcrumbListLabel": "全部节目",
      "breadcrumbCurrentLabel": "节目详情",
      "playNowLabel": "立即播放",
      "downloadTranscriptTitle": "下载文字稿 (Markdown)",
      "downloadTranscriptLabel": "下载 MD",
      "downloadMetaDateLabel": "发布日期",
      "downloadMetaAudioLabel": "音频链接",
      "infoTabLabel": "节目介绍",
      "transcriptTabLabel": "文字稿",
      "transcriptEmptyTitle": "暂无文字稿",
      "transcriptContributorsLabel": "本期主要说话人",
      "transcriptNewBadgeLabel": "New"
    }
  },
  "about": {
    "title": "关于贤者时间",
    "tagline": "“比起宏大的叙事，我们更关心具体的个人。”",
    "intro": "《贤者时间》是一档从普通人视角观察其他普通人的播客节目，由小张和治治两个普通人主持。",
    "membersTitle": "成员介绍",
    "members": [
      {
        "name": "炫彩张总",
        "links": [
          {
            "label": "微博",
            "url": "https://weibo.com/u/7455394605"
          },
          {
            "label": "公众号",
            "url": "https://open.weixin.qq.com/qr/code?username=good-fornothing"
          }
        ]
      },
      {
        "name": "治宝蛋总",
        "links": [
          {
            "label": "微博",
            "url": "https://weibo.com/u/2960664323"
          }
        ]
      },
      {
        "name": "贤者时间小管家",
        "links": [
          {
            "label": "微博",
            "url": "https://weibo.com/u/7350110112"
          },
          {
            "label": "小红书",
            "url": "https://www.xiaohongshu.com/user/profile/5db3fb49000000000100bf25"
          },
          {
            "label": "公众号",
            "url": "https://open.weixin.qq.com/qr/code?username=killtimepodcast"
          }
        ]
      }
    ],
    "contact": {
      "title": "联系我们",
      "description": "如有商务合作或听众来信，欢迎发送邮件至：",
      "email": "hi_xianzheshijian@163.com"
    },
    "feedback": {
      "title": "网站反馈",
      "description": "如果你对网站有任何建议或想法，欢迎通过以下方式反馈：",
      "formUrl": "https://alarkusw9gaaqdgm.usttp.larksuite.com/share/base/form/shrutNPtDNruGWkwTGgsJHFcM0g",
      "formButtonText": "填写反馈表单",
      "channels": []
    }
  },
  "footer": {
    "descriptionLine1": "一档从普通人视角观察其他普通人的播客节目，",
    "descriptionLine2": "由小张和治治两个普通人主持。"
  },
  "player": {
    "notPlayingLabel": "未在播放",
    "nowPlayingLabel": "正在播放",
    "expandLabel": "展开播放器",
    "minimizeLabel": "最小化",
    "minimizeAriaLabel": "最小化播放器",
    "closeLabel": "关闭",
    "closeAriaLabel": "关闭播放器",
    "prevLabel": "上一集",
    "nextLabel": "下一集",
    "backwardLabel": "后退 15 秒",
    "forwardLabel": "前进 15 秒",
    "playAriaLabel": "播放",
    "pauseAriaLabel": "暂停"
  },
  "shareCard": {
    "title": "分享剧集卡片",
    "downloadLabel": "下载图片分享",
    "qrLabel": "扫码收听",
    "generatingLabel": "正在生成...",
    "generateErrorMessage": "生成失败，请重试",
    "filenamePrefix": "xzsj"
  },
  "transcripts": {
    "placeholderNotice": "暂未提供文字稿，待使用通义听悟/NotebookLM 转化后提供"
  }
}
