{
  "$schema": "./site.schema.json",
  "site": {
    "url": "https://podstarter.netlify.app"
  },
  "features": {
    "aiTagging": false,
    "transcripts": true,
    "themes": false
  },
  "brand": {
    "name": "PodStarter",
    "establishedYear": 2026,
    "meta": {
      "description": "专为播客创作者打造的独立站开源模板，拥有自主域名、全网 RSS 同步与交互式文字稿。",
      "keywords": "PodStarter, 播客，独立播客，播客模板，RSS, 文字稿",
      "author": "PodStarter 创作者",
      "twitter": "@podstarter",
      "ogDescription": "专为播客创作者打造的独立站开源模板"
    }
  },
  "assets": {
    "defaultCover": "https://image.xyzcdn.net/FlJWzcx-KpwOJwrqSAR8CZ0w4XqA",
    "ogImage": "/og.jpg",
    "favicon": "/favicon.svg"
  },
  "podcast": {
    "rssUrl": "",
    "appleUrl": "",
    "xiaoyuzhouUrl": "",
    "xiaoyuzhouQr": "",
    "wechatQr": "",
    "ximalayaUrl": "",
    "spotifyUrl": ""
  },
  "navigation": [
    {
      "label": "首页",
      "href": "/"
    },
    {
      "label": "全部节目",
      "href": "/episodes"
    },
    {
      "label": "探索主题",
      "href": "/themes"
    },
    {
      "label": "关于我们",
      "href": "/about"
    }
  ],
  "hero": {
    "titlePrefix": "用声音记录思考，打造你的",
    "titleHighlight": "独立播客主站",
    "titleSuffix": "。",
    "description": "不依赖单一商业平台，拥有属于创作者自己的独立播客网站、全平台内容聚合与交互式文字稿。",
    "cta": {
      "listenLatestLabel": "收听最新一期",
      "browseAllDesktopLabel": "浏览全部剧集",
      "browseAllMobileLabel": "浏览全部",
      "learnMoreLabel": "了解我们"
    }
  },
  "sections": {
    "recentSubtitle": "Recent",
    "recentTitle": "最近更新",
    "recentBrowseAllLabel": "浏览全部",
    "themesTitle": "探索主题",
    "rssTitle": "保持连接",
    "rssDescription": "除了网页，你也可以在以下平台订阅我们。",
    "rssLabels": {
      "apple": "Apple Podcasts",
      "rss": "RSS 订阅",
      "xiaoyuzhou": "小宇宙",
      "wechat": "微信公众号"
    }
  },
  "ui": {
    "openMenuLabel": "打开菜单",
    "closeMenuLabel": "关闭菜单",
    "backToTopLabel": "回到顶部",
    "playLabel": "播放",
    "pauseLabel": "暂停",
    "playEpisodeAriaLabel": "播放剧集",
    "playLatestAriaLabel": "播放最新剧集",
    "downloadLabel": "下载",
    "shareLabel": "分享",
    "detailLabel": "详情",
    "closeLabel": "关闭",
    "unknownDurationLabel": "未知时长",
    "unknownSizeLabel": "未知大小",
    "episodeNumberPrefix": "Ep",
    "episodeNumberFallbackLabel": "Special"
  },
  "pages": {
    "home": {
      "title": "首页"
    },
    "episodes": {
      "title": "全部节目",
      "headline": "全部节目",
      "description": "这里记录了我们所有的对话。你可以按年份进行筛选，或者使用搜索功能查找感兴趣的话题。",
      "activeThemeLabel": "当前主题",
      "clearThemeTitle": "移除主题筛选",
      "searchLabel": "搜索节目",
      "searchPlaceholder": "搜索标题、内容...",
      "searchClearTitle": "清空搜索",
      "searchCountPrefix": "共找到",
      "searchCountSuffix": "个结果",
      "yearFilterTitle": "按年份筛选",
      "allYearsLabel": "全部",
      "tagFilterTitle": "按标签筛选",
      "clearTagLabel": "清除筛选",
      "toggleTagsExpandLabel": "展开更多",
      "toggleTagsCollapseLabel": "收起",
      "emptyTitle": "没有找到相关的节目",
      "emptySubtitle": "换个关键词，或者尝试不同的年份？"
    },
    "themes": {
      "title": "探索主题",
      "headline": "探索主题",
      "emptyLabel": "暂无相关节目"
    },
    "about": {
      "title": "关于我们"
    },
    "episodeDetail": {
      "breadcrumbListLabel": "全部节目",
      "breadcrumbCurrentLabel": "节目详情",
      "playNowLabel": "立即播放",
      "downloadTranscriptTitle": "下载文字稿 (Markdown)",
      "downloadTranscriptLabel": "下载 MD",
      "downloadMetaDateLabel": "发布日期",
      "downloadMetaAudioLabel": "音频链接",
      "infoTabLabel": "节目介绍",
      "transcriptTabLabel": "文字稿",
      "transcriptEmptyTitle": "暂无文字稿",
      "transcriptContributorsLabel": "本期主要说话人",
      "transcriptNewBadgeLabel": "New"
    }
  },
  "about": {
    "title": "关于我们",
    "tagline": "用声音记录思考，连接具体的个人。",
    "intro": "欢迎来到我们的独立播客主站。在这里，你可以浏览全部单集、对照交互文字稿精准收听、或获取最新更新。你可以在管理控制台（/admin）中随时自定义这些介绍内容与主播团队信息。",
    "membersTitle": "主播与团队成员",
    "members": [
      {
        "name": "主播 A",
        "links": [
          {
            "label": "社交主页",
            "url": "https://github.com/Eyozy/podstarter"
          }
        ],
        "role": "主理人 & 主持"
      },
      {
        "name": "主播 B",
        "links": [
          {
            "label": "即刻 / 微博",
            "url": "https://github.com/Eyozy/podstarter"
          }
        ],
        "role": "制作人 & 声音剪辑"
      }
    ],
    "contact": {
      "title": "联系我们",
      "description": "听众来信或商务合作欢迎发送邮件至：",
      "email": "hello@example.com"
    },
    "feedback": {
      "title": "网站反馈",
      "description": "如果你对网站有任何建议或想法，欢迎通过以下方式反馈：",
      "formUrl": "https://my.feishu.cn/share/base/form/shrcnE1Lsep5xvkZQStVQRCPHng",
      "formButtonText": "填写反馈表单",
      "channels": []
    }
  },
  "footer": {
    "descriptionLine1": "专为播客创作者打造的现代化独立站模板，",
    "descriptionLine2": "支持全文搜索、交互文字稿与多端适配播放器。"
  },
  "player": {
    "notPlayingLabel": "未在播放",
    "nowPlayingLabel": "正在播放",
    "expandLabel": "展开播放器",
    "minimizeLabel": "最小化",
    "minimizeAriaLabel": "最小化播放器",
    "closeLabel": "关闭",
    "closeAriaLabel": "关闭播放器",
    "prevLabel": "上一集",
    "nextLabel": "下一集",
    "backwardLabel": "后退 15 秒",
    "forwardLabel": "前进 15 秒",
    "playAriaLabel": "播放",
    "pauseAriaLabel": "暂停"
  },
  "shareCard": {
    "title": "分享剧集卡片",
    "downloadLabel": "下载图片分享",
    "qrLabel": "扫码收听",
    "generatingLabel": "正在生成...",
    "generateErrorMessage": "生成失败，请重试",
    "filenamePrefix": "podstarter"
  },
  "transcripts": {
    "placeholderNotice": "暂未提供文字稿，待使用通义听悟/NotebookLM 转化后提供"
  }
}
